05.00-3;Extração de carvão mineral;C-1
06.00-0;Extração de petróleo e gás natural;C-1
07.10-3;Extração de minério de ferro;C-1
07.21-9;Extração de minério de alumínio;C-1
07.22-7;Extração de minério de estanho;C-1
07.23-5;Extração de minério de manganês;C-1
07.24-3;Extração de minério de metais preciosos;C-1
07.25-1;Extração de minerais radioativos;C-1
07.29-4;Extração de minerais metálicos não-ferrosos não especificados anteriormente;C-1
08.10-0;Extração de pedra, areia e argila;C-1
08.91-6;Extração de minerais para fabricação de adubos, fertilizantes e outros produtos químicos;C-1
08.92-4;Extração e refino de sal marinho e sal-gema;C-1
08.93-2;Extração de gemas (pedras preciosas e semipreciosas);C-1
08.99-1;Extração de minerais não-metálicos não especificados anteriormente;C-1
09.10-6;Atividades de apoio à extração de petróleo e gás natural;C-1
09.90-4;Atividades de apoio à extração de minerais, exceto petróleo e gás natural;C-1
10.11;Abate de reses, exceto suínos;C-2
10.12-1;Abate de suínos, aves e outros pequenos animais;C-2
10.13-9;Fabricação de produtos de carne;C-2
10.20-1;Preservação do pescado e fabricação de produtos do pescado;C-2
10.31-7;Fabricação de conservas de frutas;C-2
10.32-5;Fabricação de conservas de legumes e outros vegetais;C-2
10.33-3;Fabricação de sucos de frutas, hortaliças e legumes;C-2
10.41-4;Fabricação de óleos vegetais em bruto, exceto óleo de milho;C-2
10.42-2;Fabricação de óleos vegetais refinados, exceto óleo de milho;C-2
10.43-1;Fabricação de margarina e outras gorduras vegetais e de óleos nãocomestíveis de animais;C-2
10.51-1;Preparação do leite;C-2
10.52-0;Fabricação de laticínios;C-2
10.53-8;Fabricação de sorvetes e outros gelados comestíveis;C-2
10.61-9;Beneficiamento de arroz e fabricação de produtos do arroz;C-2
10.62-7;Moagem de trigo e fabricação de derivados;C-2
10.63-5;Fabricação de farinha de mandioca e derivados;C-2
10.64-3;Fabricação de farinha de milho e derivados, exceto óleos de milho;C-2
10.65-1;Fabricação de amidos e féculas de vegetais e de óleos de milho;C-2
10.66-0;Fabricação de alimentos para animais;C-2
10.69-4;Moagem e fabricação de produtos de origem vegetal não especificados anteriormente;C-2
10.71-6;Fabricação de açúcar em bruto;C-2
10.72-4;Fabricação de açúcar refinado;C-2
10.81-3;Torrefação e moagem de café;C-2
10.82-1;Fabricação de produtos à base de café;C-2
10.91-1;Fabricação de produtos de panificação;C-2
10.92-9;Fabricação de biscoitos e bolachas;C-2
10.93-7;Fabricação de produtos derivados do cacau, de chocolates e confeitos;C-2
10.94-5;Fabricação de massas alimentícias;C-2
10.95-3;Fabricação de especiarias, molhos, temperos e condimentos;C-2
10.96-1;Fabricação de alimentos e pratos prontos;C-2
10.99-6;Fabricação de produtos alimentícios não especificados anteriormente;C-2
11.11;Fabricação de aguardentes e outras bebidas destiladas;C-2
11.12;Fabricação de vinho;C-2
11.13;Fabricação de malte, cervejas e chopes;C-2
11.21;Fabricação de águas envasadas;C-2
11.22;Fabricação de refrigerantes e de outras bebidas nãooólicas;C-2
12.10-7;Processamento industrial do fumo;C-2
12.20-4;Fabricação de produtos do fumo;C-2
13.11;Preparação e fiação de fibras de algodão;C-3
13.12-0;Preparação e fiação de fibras têxteis naturais, exceto algodão;C-3
13.13-8;Fiação de fibras artificiais e sintéticas;C-3
13.14-6;Fabricação de linhas para costurar e bordar;C-3
13.21-9;Tecelagem de fios de algodão;C-3
13.22-7;Tecelagem de fios de fibras têxteis naturais, exceto algodão;C-3
13.23-5;Tecelagem de fios de fibras artificiais e sintéticas;C-3
13.30-8;Fabricação de tecidos de malha;C-3a
13.40-5;Acabamentos em fios, tecidos e artefatos têxteis;C-3
13.51-1;Fabricação de artefatos têxteis para uso doméstico;C-3a
13.52-9;Fabricação de artefatos de tapeçaria;C-3a
13.53-7;Fabricação de artefatos de cordoaria;C-3a
13.54-5;Fabricação de tecidos especiais, inclusive artefatos;C-3a
13.59-6;Fabricação de outros produtos têxteis não especificados anteriormente;C-3a
14.11;Confecção de roupas íntimas;C-4
14.12-6;Confecção de peças do vestuário, exceto roupas íntimas;C-4
14.13-4;Confecção de roupas profissionais;C-4
14.14-2;Fabricação de acessórios do vestuário, exceto para segurança e proteção;C-4
14.21-5;Fabricação de meias;C-3a
14.22-3;Fabricação de artigos do vestuário, produzidos em malharias e tricotagens, exceto meias;C-3a
15.10-6;Curtimento e outras preparações de couro;C-5
15.21-1;Fabricação de artigos para viagem, bolsas e semelhantes de qualquer material;C-5a
15.29-7;Fabricação de artefatos de couro não especificados anteriormente;C-5a
15.31-9;Fabricação de calçados de couro;C-5
15.32-7;Fabricação de tênis de qualquer material;C-5
15.33-5;Fabricação de calçados de material sintético;C-5
15.39-4;Fabricação de calçados de materiais não especificados anteriormente;C-5
15.40-8;Fabricação de partes para calçados, de qualquer material;C-5
16.10-2;Desdobramento de madeira;C-6
16.21-8;Fabricação de madeira laminada e de chapas de madeira compensada, prensada e aglomerada;C-6
16.22-6;Fabricação de estruturas de madeira e de artigos de carpintaria para construção;C-6
16.23-4;Fabricação de artefatos de tanoaria e de embalagens de madeira;C-6
16.29-3;Fabricação de artefatos de madeira, palha, cortiça, vime e material trançado não especificados anteriormente, exceto móveis;C-6
17.10-9;Fabricação de celulose e outras pastas para a fabricação de papel;C-7a
17.21-4;Fabricação de papel;C-7a
17.22-2;Fabricação de cartolina e papel-cartão;C-7a
17.31-1;Fabricação de embalagens de papel;C-7
17.32-0;Fabricação de embalagens de cartolina e papel-cartão;C-7
17.33-8;Fabricação de chapas e de embalagens de papelão ondulado;C-7
17.41-9;Fabricação de produtos de papel, cartolina, papel-cartão e papelão ondulado para uso comercial e de escritório;C-7
17.42-7;Fabricação de produtos de papel para usos doméstico e higiênicosanitário;C-7
17.49-4;Fabricação de produtos de pastas celulósicas, papel, cartolina, papelcartão e papelão ondulado não especificados anteriormente;C-7
18.11;Impressão de jornais, livros, revistas e outras publicações periódicas;C-8
18.12-1;Impressão de material de segurança;C-8
18.13-0;Impressão de materiais para outros usos;C-8
18.21-1;Serviços de pré-impressão;C-8
18.22-9;Serviços de acabamentos gráficos;C-8
18.30-0;Reprodução de materiais gravados em qualquer suporte;C-9
19.10-1;Coquerias;C-1
19.21-7;Fabricação de produtos do refino de petróleo;C-1a
19.22-5;Fabricação de produtos derivados do petróleo, exceto produtos do refino;C-1a
19.31-4;Fabricação de álcool;C-1a
19.32-2;Fabricação de biocombustíveis, exceto álcool;C-10
20.11;Fabricação de cloro e álcalis;C-10
20.12-6;Fabricação de intermediários para fertilizantes;C-10
20.13-4;Fabricação de adubos e fertilizantes;C-10
20.14-2;Fabricação de gases industriais;C-10
20.19-3;Fabricação de produtos químicos inorgânicos não especificados anteriormente;C-10
20.21-5;Fabricação de produtos petroquímicos básicos;C-10
20.22-3;Fabricação de intermediários para plastificantes, resinas e fibras;C-10
20.29-1;Fabricação de produtos químicos orgânicos não especificados anteriormente;C-10
20.31-2;Fabricação de resinas termoplásticas;C-10
20.32-1;Fabricação de resinas termofixas;C-10
20.33-9;Fabricação de elastômeros;C-10
20.40-1;Fabricação de fibras artificiais e sintéticas;C-10
20.51-7;Fabricação de defensivos agrícolas;C-10
20.52-5;Fabricação de desinfestantes domissanitários;C-10
20.61-4;Fabricação de sabões e detergentes sintéticos;C-10
20.62-2;Fabricação de produtos de limpeza e polimento;C-10
20.63-1;Fabricação de cosméticos, produtos de perfumaria e de higiene pessoal;C-10
20.71-1;Fabricação de tintas, vernizes, esmaltes e lacas;C-10
20.72-0;Fabricação de tintas de impressão;C-10
20.73-8;Fabricação de impermeabilizantes, solventes e produtos afins;C-10
20.91-6;Fabricação de adesivos e selantes;C-10
20.92-4;Fabricação de explosivos;C-15
20.93-2;Fabricação de aditivos de uso industrial;C-10
20.94-1;Fabricação de catalisadores;C-10
20.99-1;Fabricação de produtos químicos não especificados anteriormente;C-10
21.10-6;Fabricação de produtos farmoquímicos;C-10
21.21-1;Fabricação de medicamentos para uso humano;C-10
21.22-0;Fabricação de medicamentos para uso veterinário;C-10
21.23-8;Fabricação de preparações farmacêuticas;C-10
22.11-1;Fabricação de pneumáticos e de câmaras-de-ar;C-11
22.12-9;Reforma de pneumáticos usados;C-11
22.19-6;Fabricação de artefatos de borracha não especificados anteriormente;C-11
22.21-8;Fabricação de laminados planos e tubulares de material plástico;C-10
22.22-6;Fabricação de embalagens de material plástico;C-10
22.23-4;Fabricação de tubos e acessórios de material plástico para uso na construção;C-10
22.29-3;Fabricação de artefatos de material plástico não especificados anteriormente;C-10
23.11-7;Fabricação de vidro plano e de segurança;C12
23.12-5;Fabricação de embalagens de vidro;C12
23.19-2;Fabricação de artigos de vidro;C-12
23.20-6;Fabricação de cimento;C-1
23.30-3;Fabricação de artefatos de concreto, cimento, fibrocimento, gesso e materiais semelhantes;C-12
23.41-9;Fabricação de produtos cerâmicos refratários;C-12
23.42-7;Fabricação de produtos cerâmicos não-refratários para uso estrutural na construção;C-12
23.49-4;Fabricação de produtos cerâmicos não-refratários não especificados anteriormente;C-12
23.91-5;Aparelhamento e outros trabalhos em pedras;C-1
23.92-3;Fabricação de cal e gesso;C-12
23.99-1;Fabricação de produtos de minerais não-metálicos não especificados anteriormente;C-12
24.11-3;Produção de ferro-gusa;C-13
24.12-1;Produção de ferroligas;C-13
24.21-1;Produção de semi-acabados de aço;C-13
24.22-9;Produção de laminados planos de aço;C-13
24.23-7;Produção de laminados longos de aço;C-13
24.24-5;Produção de relaminados, trefilados e perfilados de aço;C-13
24.31-8;Produção de tubos de aço com costura;C-13
24.39-3;Produção de outros tubos de ferro e aço;C-13
24.41-5;Metalurgia do alumínio e suas ligas;C-13
24.42-3;Metalurgia dos metais preciosos;C-13
24.43-1;Metalurgia do cobre;C-13
24.49-1;Metalurgia dos metais não-ferrosos e suas ligas não especificados anteriormente;C-13
24.51-2;Fundição de ferro e aço;C-13
24.52-1;Fundição de metais não-ferrosos e suas ligas;C-13
25.11-0;Fabricação de estruturas metálicas;C-13
25.12-8;Fabricação de esquadrias de metal;C-14
25.13-6;Fabricação de obras de caldeiraria pesada;C-13
25.21-7;Fabricação de tanques, reservatórios metálicos e caldeiras para aquecimento central;C-14
25.22-5;Fabricação de caldeiras geradoras de vapor, exceto para aquecimento central e para veículos;C-14
25.31-4;Produção de forjados de aço e de metais não-ferrosos e suas ligas;C-13
25.32-2;"Produção de artefatos estampados de metal; metalurgia do pó";C-13
25.39-0;Serviços de usinagem, solda, tratamento e revestimento em metais;C-13
25.41-1;Fabricação de artigos de cutelaria;C-14
25.42-0;Fabricação de artigos de serralheria, exceto esquadrias;C-14
25.43-8;Fabricação de ferramentas;C-14
25.50-1;Fabricação de equipamento bélico pesado, armas de fogo e munições;C-15
25.91-8;Fabricação de embalagens metálicas;C-14
25.92-6;Fabricação de produtos de trefilados de metal;C-13
25.93-4;Fabricação de artigos de metal para uso doméstico e pessoal;C-14
25.99-3;Fabricação de produtos de metal não especificados anteriormente;C-14
26.10-8;Fabricação de componentes eletrônicos;C-14
26.21-3;Fabricação de equipamentos de informática;C-14
26.22-1;Fabricação de periféricos para equipamentos de informática;C-14
26.31-1;Fabricação de equipamentos transmissores de comunicação;C-14
26.32-9;Fabricação de aparelhos telefônicos e de outros equipamentos de comunicação;C-14
26.40-0;Fabricação de aparelhos de recepção, reprodução, gravação e amplificação de áudio e vídeo;C-14
26.51-5;Fabricação de aparelhos e equipamentos de medida, teste e controle;C-14
26.52-3;Fabricação de cronômetros e relógios;C-14
26.60-4;Fabricação de aparelhos eletromédicos e eletroterapêuticos e equipamentos de irradiação;C-14
26.70-1;Fabricação de equipamentos e instrumentos ópticos, fotográficos e cinematográficos;C-14
26.80-9;Fabricação de mídias virgens, magnéticas e ópticas;C-10
27.10-4;Fabricação de geradores, transformadores e motores elétricos;C-14
27.21-0;Fabricação de pilhas, baterias e acumuladores elétricos, exceto para veículos automotores;C-10
27.22-8;Fabricação de baterias e acumuladores para veículos automotores;C-10
27.31-7;Fabricação de aparelhos e equipamentos para distribuição e controle de energia elétrica;C-14
27.32-5;Fabricação de material elétrico para instalações em circuito de consumo;C-14
27.33-3;Fabricação de fios, cabos e condutores elétricos isolados;C-14
27.40-6;Fabricação de lâmpadas e outros equipamentos de iluminação;C-14
27.51-1;Fabricação de fogões, refrigeradores e máquinas de lavar e secar para uso doméstico;C-14
27.59-7;Fabricação de aparelhos eletrodomésticos não especificados anteriormente;C-14
27.90-2;Fabricação de equipamentos e aparelhos elétricos não especificados anteriormente;C-14
28.11-9;Fabricação de motores e turbinas, exceto para aviões e veículos rodoviários;C-14
28.12-7;Fabricação de equipamentos hidráulicos e pneumáticos, exceto válvulas;C-14
28.13-5;Fabricação de válvulas, registros e dispositivos semelhantes;C-14
28.14-3;Fabricação de compressores;C-14
28.15-1;Fabricação de equipamentos de transmissão para fins industriais;C-14
28.21-6;Fabricação de aparelhos e equipamentos para instalações térmicas;C-14
28.22-4;Fabricação de máquinas, equipamentos e aparelhos para transporte e elevação de cargas e pessoas;C-14
28.23-2;Fabricação de máquinas e aparelhos de refrigeração e ventilação para uso industrial e comercial;C-14
28.24-1;Fabricação de aparelhos e equipamentos de ar condicionado;C-14
28.25-9;Fabricação de máquinas e equipamentos para saneamento básico e ambiental;C-14
28.29-1;Fabricação de máquinas e equipamentos de uso geral não especificados anteriormente;C-14a
28.31-3;Fabricação de tratores agrícolas;C-16
28.32-1;Fabricação de equipamentos para irrigação agrícola;C-14
28.33-0;Fabricação de máquinas e equipamentos para a agricultura e pecuária, exceto para irrigação;C-14
28.40-2;Fabricação de máquinas-ferramenta;C-14
28.51-8;Fabricação de máquinas e equipamentos para a prospecção e extração de petróleo;C-14
28.52-6;Fabricação de outras máquinas e equipamentos para uso na extração mineral, exceto na extração de petróleo;C-14
28.53-4;Fabricação de tratores, exceto agrícolas;C-16
28.54-2;Fabricação de máquinas e equipamentos para terraplenagem, pavimentação e construção, exceto tratores;C-14
28.61-5;Fabricação de máquinas para a indústria metalúrgica, exceto máquinas- ferramenta;C-14
28.62-3;Fabricação de máquinas e equipamentos para as indústrias de alimentos, bebidas e fumo;C-14
28.63-1;Fabricação de máquinas e equipamentos para a indústria têxtil;C-14
28.64-0;Fabricação de máquinas e equipamentos para as indústrias do vestuário, do couro e de calçados;C-14
28.65-8;Fabricação de máquinas e equipamentos para as indústrias de celulose, papel e papelão e artefatos;C-14
28.66-6;Fabricação de máquinas e equipamentos para a indústria do plástico;C-14
28.69-1;Fabricação de máquinas e equipamentos para uso industrial específico não especificados anteriormente;C-14
29.10-7;Fabricação de automóveis, camionetas e utilitários;C-16
29.20-4;Fabricação de caminhões e ônibus;C-16
29.30-1;Fabricação de cabines, carrocerias e reboques para veículos automotores;C-16
29.41-7;Fabricação de peças e acessórios para o sistema motor de veículos automotores;C-16
29.42-5;Fabricação de peças e acessórios para os sistemas de marcha e transmissão de veículos automotores;C-16
29.43-3;Fabricação de peças e acessórios para o sistema de freios de veículos automotores;C-16
29.44-1;Fabricação de peças e acessórios para o sistema de direção e suspensão de veículos automotores;C-16
29.45-0;Fabricação de material elétrico e eletrônico para veículos automotores, exceto baterias;C-14
29.49-2;Fabricação de peças e acessórios para veículos automotores não especificados anteriormente;C-16
29.50-6;Recondicionamento e recuperação de motores para veículos automotores;C-16
30.11-3;Construção de embarcações e estruturas flutuantes;C-16
30.12-1;Construção de embarcações para esporte e lazer;C-16
30.31-8;Fabricação de locomotivas, vagões e outros materiais rodantes;C-16
30.32-6;Fabricação de peças e acessórios para veículos ferroviários;C-16
30.41-5;Fabricação de aeronaves;C-16
30.42-3;Fabricação de turbinas, motores e outros componentes e peças para aeronaves;C-16
30.50-4;Fabricação de veículos militares de combate;C-16
30.91-1;Fabricação de motocicletas;C-16
30.92-0;Fabricação de bicicletas e triciclos não-motorizados;C-16
30.99-7;Fabricação de equipamentos de transporte não especificados anteriormente;C-16
31.01-2;Fabricação de móveis com predominância de madeira;C-6
31.02-1;Fabricação de móveis com predominância de metal;C-14
31.03-9;Fabricação de móveis de outros materiais, exceto madeira e metal;C-14
31.04-7;Fabricação de colchões;C-10
32.11-6;Lapidação de gemas e fabricação de artefatos de ourivesaria e joalheria;C-12
32.12-4;Fabricação de bijuterias e artefatos semelhantes;C-14a
32.20-5;Fabricação de instrumentos musicais;C-14a
32.30-2;Fabricação de artefatos para pesca e esporte;C-14
32.40-0;Fabricação de brinquedos e jogos recreativos;C-14
32.50-7;Fabricação de instrumentos e materiais para uso médico e odontológico e de artigos ópticos;C-14
32.91-4;Fabricação de escovas, pincéis e vassouras;C-14a
32.92-2;Fabricação de equipamentos e acessórios para segurança e proteção pessoal e profissional;C-4
32.99-0;Fabricação de produtos diversos não especificados anteriormente;C-14a
33.11-2;Manutenção e reparação de tanques, reservatórios metálicos e caldeiras, exceto para veículos;C-14
33.12-1;Manutenção e reparação de equipamentos eletrônicos e ópticos;C-14
33.13-9;Manutenção e reparação de máquinas e equipamentos elétricos;C-14
33.14-7;Manutenção e reparação de máquinas e equipamentos da indústria mecânica;C-14
33.15-5;Manutenção e reparação de veículos ferroviários;C-16
33.16-3;Manutenção e reparação de aeronaves;C-16
33.17-1;Manutenção e reparação de embarcações;C-16
33.19-8;Manutenção e reparação de equipamentos e produtos não especificados anteriormente;C-14
33.21-0;Instalação de máquinas e equipamentos industriais;C-14
33.29-5;Instalação de equipamentos não especificados anteriormente;C-14a
35.11-5;Geração de energia elétrica;C-17
35.12-3;Transmissão de energia elétrica;C-17
35.13-1;Comércio atacadista de energia elétrica;C-17
35.14-0;Distribuição de energia elétrica;C-17
35.20-4;"Produção de gás; processamento de gás natural; distribuição de combustíveis gasosos por redes urbanas";C-17
35.30-1;Produção e distribuição de vapor, água quente e ar condicionado;C-17
36.00-6;Captação, tratamento e distribuição de água;C-17
37.01-1;Gestão de redes de esgoto;C-17
37.02-9;Atividades relacionadas a esgoto, exceto a gestão de redes;C-17
38.11-4;Coleta de resíduos nãoigosos;C-17
38.12-2;Coleta de resíduos perigosos;C-17
38.21-1;Tratamento e disposição de resíduos não-perigosos;C-17
38.22-0;Tratamento e disposição de resíduos perigosos;C-17
38.31-9;Recuperação de materiais metálicos;C-14
38.32-7;Recuperação de materiais plásticos;C-12
38.39-4;Recuperação de materiais não especificados anteriormente;C-12
39.00-5;Descontaminação e outros serviços de gestão de resíduos;C-17
41.10-7;Incorporação de empreendimentos imobiliários;C-29
41.20-4;Construção de edifícios;C-18a
42.11-1;Construção de rodovias e ferrovias;C-18a
42.12-0;Construção de obras-de-arte especiais;C-18a
42.13-8;Obras de urbanização - ruas, praças e calçadas;C-18a
42.21-9;Obras para geração e distribuição de energia elétrica e para telecomunicações;C-18a
42.22-7;Construção de redes de abastecimento de água, coleta de esgoto e construções correlatas;C-18
42.23-5;Construção de redes de transportes por dutos, exceto para água e esgoto;C-18
42.91-0;Obras portuárias, marítimas e fluviais;C-18
42.92-8;Montagem de instalações industriais e de estruturas metálicas;C-18a
42.99-5;Obras de engenharia civil não especificadas anteriormente;C-18
43.11-8;Demolição e preparação de canteiros de obras;C-18a
43.12-6;Perfurações e sondagens;C-18a
43.13-4;Obras de terraplenagem;C-18a
43.19-3;Serviços de preparação do terreno não especificados anteriormente;C-18a
43.21-5;Instalações elétricas;C-18
43.22-3;Instalações hidráulicas, de sistemas de ventilação e refrigeração;C-18
43.29-1;Obras de instalações em construções não especificadas anteriormente;C-18
43.30-4;Obras de acabamento;C-18
43.91-6;Obras de fundações;C-18a
43.99-1;Serviços especializados para construção não especificados anteriormente;C-18
45.11-1;Comércio a varejo e por atacado de veículos automotores;C-21
45.12-9;Representantes comerciais e agentes do comércio de veículos automotores;C-21
45.20-0;Manutenção e reparação de veículos automotores;C-16
45.30-7;Comércio de peças e acessórios para veículos automotores;C-21
45.41-2;Comércio por atacado e a varejo de motocicletas, peças e acessórios;C-21
45.42-1;Representantes comerciais e agentes do comércio de motocicletas, peças e acessórios;C-21
45.43-9;Manutenção e reparação de motocicletas;C-16
46.11-7;Representantes comerciais e agentes do comércio de matériasmas agrícolas e animais vivos;C-19
46.12-5;Representantes comerciais e agentes do comércio de combustíveis, minerais, produtos siderúrgicos e químicos;C-22
46.13-3;Representantes comerciais e agentes do comércio de madeira, material de construção e ferragens;C-20
46.14-1;Representantes comerciais e agentes do comércio de máquinas, equipamentos, embarcações e aeronaves;C-19
46.15-0;Representantes comerciais e agentes do comércio de eletrodomésticos, móveis e artigos de uso doméstico;C-19
46.16-8;Representantes comerciais e agentes do comércio de têxteis, vestuário, calçados e artigos de viagem;C-19
46.17-6;Representantes comerciais e agentes do comércio de produtos alimentícios, bebidas e fumo;C-19
46.18-4;Representantes comerciais e agentes do comércio especializado em produtos não especificados anteriormente;C-19
46.19-2;Representantes comerciais e agentes do comércio de mercadorias em geral não especializado;C-19
46.21-4;Comércio atacadista de café em grão;C-20
46.22-2;Comércio atacadista de soja;C-20
46.23-1;Comércio atacadista de animais vivos, alimentos para animais e matérias- primas agrícolas, exceto café e soja;C-20
46.31-1;Comércio atacadista de leite e laticínios;C-20
46.32-0;Comércio atacadista de cereais e leguminosas beneficiados, farinhas, amidos e féculas;C-20
46.33-8;Comércio atacadista de hortifrutigranjeiros;C-20
46.34-6;Comércio atacadista de carnes, produtos da carne e pescado;C-20
46.35-4;Comércio atacadista de bebidas;C-20
46.36-2;Comércio atacadista de produtos do fumo;C-20
46.37-1;Comércio atacadista especializado em produtos alimentícios não especificados anteriormente;C-20
46.39-7;Comércio atacadista de produtos alimentícios em geral;C-20
20.71-1;Fabricação de tintas, vernizes, esmaltes e lacas;C-10
20.72-0;Fabricação de tintas de impressão;C-10
20.73-8;Fabricação de impermeabilizantes, solventes e produtos afins;C-10
20.91-6;Fabricação de adesivos e selantes;C-10
20.92-4;Fabricação de explosivos;C-15
20.93-2;Fabricação de aditivos de uso industrial;C-10
20.94-1;Fabricação de catalisadores;C-10
20.99-1;Fabricação de produtos químicos não especificados anteriormente;C-10
21.10-6;Fabricação de produtos farmoquímicos;C-10
21.21-1;Fabricação de medicamentos para uso humano;C-10
21.22-0;Fabricação de medicamentos para uso veterinário;C-10
21.23-8;Fabricação de preparações farmacêuticas;C-10
22.11-1;Fabricação de pneumáticos e de câmarasar;C11
22.12-9;Reforma de pneumáticos usados;C11
22.19-6;Fabricação de artefatos de borracha não especificados anteriormente;C11
22.21-8;Fabricação de laminados planos e tubulares de material plástico;C-10
22.22-6;Fabricação de embalagens de material plástico;C-10
22.23-4;Fabricação de tubos e acessórios de material plástico para uso na construção;C-10
22.29-3;Fabricação de artefatos de material plástico não especificados anteriormente;C-10
23.11-7;Fabricação de vidro plano e de segurança;C12
23.12-5;Fabricação de embalagens de vidro;C12
23.19-2;Fabricação de artigos de vidro;C-12
23.20-6;Fabricação de cimento;C-1
23.30-3;Fabricação de artefatos de concreto, cimento, fibrocimento, gesso e materiais semelhantes;C-12
23.41-9;Fabricação de produtos cerâmicos refratários;C-12
23.42-7;Fabricação de produtos cerâmicos não-refratários para uso estrutural na construção;C-12
23.49-4;Fabricação de produtos cerâmicos não-refratários não especificados anteriormente;C-12
23.91-5;Aparelhamento e outros trabalhos em pedras;C-1
23.92-3;Fabricação de cal e gesso;C-12
23.99-1;Fabricação de produtos de minerais não-metálicos não especificados anteriormente;C-12
24.11-3;Produção de ferroa;C-13
